{
  "schema_version": "1.0.0",
  "sample_sha256": "aaaaaaaaaaaaaaaaaaaaaaaaaaaaaaaaaaaaaaaaaaaaaaaaaaaaaaaaaaaaaaaa",
  "tenant_id": "tenant-test",
  "file_type": "unknown",
  "hashes": {
    "md5": "d41d8cd98f00b204e9800998ecf8427e",
    "sha1": "da39a3ee5e6b4b0d3255bfef95601890afd80709",
    "sha256": "aaaaaaaaaaaaaaaaaaaaaaaaaaaaaaaaaaaaaaaaaaaaaaaaaaaaaaaaaaaaaaaa",
    "sha512": "cf83e1357eefb8bdf1542850d66d8007d620e4050b5715dc83f4a921d36ce9ce47d0d13c5d85f2b0ff8318d2877eec2f63b931bd47417a81a538327af927da3e00"
  },
  "summary": {
    "verdict": "suspicious",
    "score": 50
  },
  "findings": [
    {
      "id": "finding-entropy-0",
      "title": "High Entropy Content Detected",
      "severity": "MEDIUM",
      "confidence": 75,
      "description": "Found 3 chunks with entropy above 7.5, indicating possible encryption or packing",
      "evidence": [
        {"type": "entropy", "value": "offset=0,entropy=7.81"},
        {"type": "entropy", "value": "offset=4096,entropy=7.92"},
        {"type": "entropy", "value": "offset=8192,entropy=7.76"}
      ],
      "tags": ["encryption", "packing", "entropy"],
      "source": "triage-universal",
      "references": [],
      "affected_objects": [],
      "created_at": "2024-06-01T12:00:00+00:00"
    },
    {
      "id": "finding-network-1",
      "title": "Network Indicators Detected",
      "severity": "HIGH",
      "confidence": 80,
      "description": "Found 2 URLs and 3 domains embedded in sample",
      "evidence": [
        {"type": "url", "value": "http://malware-c2.example.com/beacon"},
        {"type": "url", "value": "https://update.evil.net/payload.bin"},
        {"type": "domain", "value": "malware-c2.example.com"},
        {"type": "domain", "value": "update.evil.net"},
        {"type": "domain", "value": "exfil.attacker.org"}
      ],
      "tags": ["network", "ioc", "c2"],
      "source": "triage-universal",
      "references": ["https://attack.mitre.org/techniques/T1071/"],
      "affected_objects": [],
      "created_at": "2024-06-01T12:00:00+00:00"
    },
    {
      "id": "finding-email-2",
      "title": "Email Addresses Detected",
      "severity": "LOW",
      "confidence": 60,
      "description": "Found 1 email address embedded in sample",
      "evidence": [
        {"type": "email", "value": "operator@attacker.org"}
      ],
      "tags": ["email", "ioc"],
      "source": "triage-universal",
      "references": [],
      "affected_objects": [],
      "created_at": "2024-06-01T12:00:00+00:00"
    }
  ],
  "iocs": [
    {
      "type": "url",
      "value": "http://malware-c2.example.com/beacon",
      "normalized": "http://malware-c2.example.com/beacon",
      "confidence": 70,
      "context": "Extracted from sample strings",
      "first_seen_in": "aaaaaaaaaaaaaaaaaaaaaaaaaaaaaaaaaaaaaaaaaaaaaaaaaaaaaaaaaaaaaaaa",
      "tags": ["network"]
    },
    {
      "type": "url",
      "value": "https://update.evil.net/payload.bin",
      "normalized": "https://update.evil.net/payload.bin",
      "confidence": 70,
      "context": "Extracted from sample strings",
      "first_seen_in": "aaaaaaaaaaaaaaaaaaaaaaaaaaaaaaaaaaaaaaaaaaaaaaaaaaaaaaaaaaaaaaaa",
      "tags": ["network"]
    },
    {
      "type": "domain",
      "value": "malware-c2.example.com",
      "normalized": "malware-c2.example.com",
      "confidence": 70,
      "context": "Extracted from sample strings",
      "first_seen_in": "aaaaaaaaaaaaaaaaaaaaaaaaaaaaaaaaaaaaaaaaaaaaaaaaaaaaaaaaaaaaaaaa",
      "tags": ["network"]
    },
    {
      "type": "domain",
      "value": "update.evil.net",
      "normalized": "update.evil.net",
      "confidence": 70,
      "context": "Extracted from sample strings",
      "first_seen_in": "aaaaaaaaaaaaaaaaaaaaaaaaaaaaaaaaaaaaaaaaaaaaaaaaaaaaaaaaaaaaaaaa",
      "tags": ["network"]
    },
    {
      "type": "domain",
      "value": "exfil.attacker.org",
      "normalized": "exfil.attacker.org",
      "confidence": 70,
      "context": "Extracted from sample strings",
      "first_seen_in": "aaaaaaaaaaaaaaaaaaaaaaaaaaaaaaaaaaaaaaaaaaaaaaaaaaaaaaaaaaaaaaaa",
      "tags": ["network"]
    },
    {
      "type": "ip",
      "value": "10.0.0.1",
      "normalized": "10.0.0.1",
      "confidence": 60,
      "context": "Extracted from sample strings",
      "first_seen_in": "aaaaaaaaaaaaaaaaaaaaaaaaaaaaaaaaaaaaaaaaaaaaaaaaaaaaaaaaaaaaaaaa",
      "tags": ["network"]
    },
    {
      "type": "email",
      "value": "operator@attacker.org",
      "normalized": "operator@attacker.org",
      "confidence": 50,
      "context": "Extracted from sample strings",
      "first_seen_in": "aaaaaaaaaaaaaaaaaaaaaaaaaaaaaaaaaaaaaaaaaaaaaaaaaaaaaaaaaaaaaaaa",
      "tags": ["contact"]
    }
  ],
  "artifacts": [
    {
      "type": "strings",
      "path": "artifacts/strings.txt",
      "sha256": "bbbbbbbbbbbbbbbbbbbbbbbbbbbbbbbbbbbbbbbbbbbbbbbbbbbbbbbbbbbbbbbb",
      "mime": "text/plain",
      "size_bytes": 1420,
      "produced_by": "triage-universal"
    }
  ],
  "provenance": {
    "pipeline_name": "triage",
    "pipeline_hash": "cccccccccccccccccccccccccccccccccccccccccccccccccccccccccccccccc",
    "engines": [
      {
        "name": "triage-universal",
        "version": "0.1.0"
      }
    ],
    "config_hash": "dddddddddddddddddddddddddddddddddddddddddddddddddddddddddddddddd",
    "deterministic_run": true
  },
  "timestamps": {
    "analysis_start": "2024-06-01T12:00:00+00:00",
    "analysis_end": "2024-06-01T12:00:02+00:00"
  }
}
